{
  "$schema": "http://json-schema.org/draft-07/schema#",
  "$id": "https://goodboy.dev/schema/v1/manifest.schema.json",
  "title": "GoodBoy Skill Manifest",
  "description": "Schema for a GoodBoy skill manifest file",
  "type": "object",
  "required": ["name", "version", "description", "author", "license", "entry", "language", "schema_version", "status"],
  "additionalProperties": false,
  "properties": {
    "name": {
      "type": "string",
      "pattern": "^[a-z0-9-]+$",
      "minLength": 1,
      "maxLength": 128
    },
    "version": {
      "type": "string",
      "pattern": "^\\d+\\.\\d+\\.\\d+$"
    },
    "description": {
      "type": "string",
      "maxLength": 280
    },
    "author": {
      "type": "object",
      "required": ["name"],
      "additionalProperties": false,
      "properties": {
        "name": {
          "type": "string"
        },
        "email": {
          "type": "string",
          "format": "email"
        },
        "url": {
          "type": "string",
          "format": "uri"
        }
      }
    },
    "license": {
      "type": "string"
    },
    "keywords": {
      "type": "array",
      "items": {
        "type": "string"
      },
      "maxItems": 10
    },
    "category": {
      "type": "string",
      "enum": ["code", "writing", "data", "devops", "testing", "documentation", "productivity", "other"]
    },
    "readme": {
      "type": "string"
    },
    "homepage": {
      "type": "string",
      "format": "uri"
    },
    "repository": {
      "type": "object",
      "additionalProperties": false,
      "properties": {
        "type": {
          "type": "string"
        },
        "url": {
          "type": "string",
          "format": "uri"
        }
      }
    },
    "changelog": {
      "type": "string",
      "format": "uri"
    },
    "entry": {
      "type": "string"
    },
    "language": {
      "type": "string",
      "enum": ["typescript", "javascript", "python", "rust", "other"]
    },
    "claude_code_version": {
      "type": "string"
    },
    "mcp_servers": {
      "type": "array",
      "items": {
        "type": "object",
        "additionalProperties": false,
        "properties": {
          "name": {
            "type": "string"
          },
          "url": {
            "type": "string",
            "format": "uri"
          }
        }
      }
    },
    "engines": {
      "type": "object",
      "additionalProperties": false,
      "properties": {
        "node": {
          "type": "string"
        },
        "python": {
          "type": "string"
        }
      }
    },
    "os": {
      "type": "array",
      "items": {
        "type": "string",
        "enum": ["darwin", "linux", "win32"]
      }
    },
    "schema_version": {
      "type": "string",
      "const": "1.0.0"
    },
    "dependencies": {
      "type": "object",
      "additionalProperties": {
        "type": "string"
      }
    },
    "devDependencies": {
      "type": "object",
      "additionalProperties": {
        "type": "string"
      }
    },
    "permissions": {
      "type": "array",
      "items": {
        "type": "string",
        "enum": ["read_files", "write_files", "network", "shell", "env"]
      }
    },
    "hooks": {
      "type": "object",
      "additionalProperties": false,
      "properties": {
        "preinstall": {
          "type": "string"
        },
        "postinstall": {
          "type": "string"
        },
        "preremove": {
          "type": "string"
        },
        "postremove": {
          "type": "string"
        }
      }
    },
    "status": {
      "type": "string",
      "enum": ["experimental", "stable", "deprecated"],
      "default": "experimental"
    },
    "publisher": {
      "type": "string"
    },
    "visibility": {
      "type": "string",
      "enum": ["public", "private"],
      "default": "private"
    }
  }
}
